PLAYERS,,PASSING,,,,RUSHING,,,RECEIVING,,,TOTAL
RNK,PLAYER TEAM POS,C/A,YDS,TD,INT,RUSH,YDS,TD,REC,YDS,TD,PTS
1,Adrian Peterson Min RB,0/0,0,0,0,300.3,1394.6,9.9,29.4,227.3,0.8,219.1
2,Todd Gurley LA RB,0/0,0,0,0,297.8,1323.1,10.5,38.5,309,0.9,226.4
3,Ezekiel Elliott Dal RB P,0/0,0,0,0,266.3,1159.2,8.6,48.8,414.1,1.7,214.5
4,David Johnson Ari RB,0/0,0,0,0,251.1,1037.8,8.2,58.3,530.6,2.6,216.5
5,Devonta Freeman Atl RB,0/0,0,0,0,232.2,926.1,6.7,69.1,549.4,2.3,197.6
6,Le'Veon Bell Pit RB SSPD,0/0,0,0,0,215.4,942.2,6.3,56.5,482.5,2.4,195.6
7,Lamar Miller Hou RB,0/0,0,0,0,280.5,1235,7.2,43.7,325.3,1.3,204.6
8,Doug Martin TB RB P,0/0,0,0,0,268.8,1196.8,6.6,31.8,246.5,1,185
9,Mark Ingram NO RB,0/0,0,0,0,234.7,977.6,8.5,56.4,391.5,1.8,195.2
10,Eddie Lacy GB RB,0/0,0,0,0,240.8,1035.9,6.4,29.1,235.4,1.3,167.9
11,Jamaal Charles KC RB P,0/0,0,0,0,218.7,1121.6,8.4,46.8,392.2,2.2,207.1
12,LeSean McCoy Buf RB,0/0,0,0,0,271.4,1193.4,8.7,46.6,345.5,1.7,213.3
13,Thomas Rawls Sea RB P,0/0,0,0,0,222.5,1034.9,5.7,17.9,143.4,1,155.5
14,Jonathan Stewart Car RB,0/0,0,0,0,236.7,1021.7,6.5,20.1,148.9,0.6,156.3
15,Carlos Hyde SF RB,0/0,0,0,0,255.2,1025.4,7.1,33.9,242.1,0.9,171.7
16,C.J. Anderson Den RB,0/0,0,0,0,246.2,1098.2,7.4,30.2,243.6,0.9,181.1
17,Matt Forte NYJ RB P,0/0,0,0,0,187.5,770.1,4.3,48,402.3,1.5,150.6
18,Jeremy Hill Cin RB,0/0,0,0,0,222.3,910.5,7.1,19,141.9,0.8,147.9
19,Latavius Murray Oak RB,0/0,0,0,0,229.6,973.4,5.5,33.4,237.7,1.6,159.8
20,Ryan Mathews Phi RB,0/0,0,0,0,204.6,927.2,6.1,25.3,186.4,0.5,145.2
21,DeMarco Murray Ten RB,0/0,0,0,0,224.9,982.1,7.4,25.3,192.8,0.6,162.9
22,Jeremy Langford Chi RB,0/0,0,0,0,187.9,758.1,5.5,34.4,307.2,1.1,141.8
23,Matt Jones Wsh RB Q,0/0,0,0,0,222.8,888.7,5.1,21.8,213.6,0.9,137.1
24,Arian Foster Mia RB,0/0,0,0,0,170.9,726.7,5.2,35.6,290.4,1.4,137.1
25,Melvin Gordon SD RB,0/0,0,0,0,238.6,914.1,3.9,33.1,218.4,1.1,134.1
26,Duke Johnson Jr. Cle RB P,0/0,0,0,0,151.3,614.1,3.6,52.4,416.1,1.5,131.7
27,Danny Woodhead SD RB,0/0,0,0,0,100,402.4,2.2,69.4,610.4,3.7,136.8
28,Frank Gore Ind RB,0/0,0,0,0,222.2,900.2,5.5,32.6,277,1.4,155.9
29,Rashad Jennings NYG RB,0/0,0,0,0,194.8,853,4.8,32,255.1,1,143
30,DeAngelo Williams Pit RB,0/0,0,0,0,126.4,594.9,3.3,12.9,112.3,0.4,90.9
31,T.J. Yeldon Jax RB,0/0,0,0,0,155,645.7,3.7,35.7,274.8,1.4,119.1
32,Giovani Bernard Cin RB,0/0,0,0,0,152.6,654.9,3.9,49.5,410.4,1.3,136
33,Ameer Abdullah Det RB P,0/0,0,0,0,187.1,800.2,4.7,37.2,294,1.2,139.2
34,Chris Ivory Jax RB,0/0,0,0,0,163.7,718.5,5,20.3,142.6,0.7,117.4
35,Derrick Henry Ten RB,0/0,0,0,0,157.4,670.1,6.5,17.1,141.1,0.6,121.4
36,Bilal Powell NYJ RB,0/0,0,0,0,127.6,521.5,2.7,42.7,338,1.3,107
37,Jay Ajayi Mia RB,0/0,0,0,0,99.7,405.9,3.1,13.3,95.8,0.4,68.9
38,Theo Riddick Det RB,0/0,0,0,0,63.6,257.2,1.9,69,599.7,2.8,111.5
39,Justin Forsett Bal RB,0/0,0,0,0,145.1,659.4,3.5,27.1,183.4,0.7,108.2
40,Charles Sims TB RB,0/0,0,0,0,105.9,438.8,2.4,54.6,459.2,1.9,111.6
41,Isaiah Crowell Cle RB,0/0,0,0,0,182.8,741.4,4.7,15.2,116.7,0.5,115.6
42,James Starks GB RB,0/0,0,0,0,112.4,478.1,2.4,20.6,160,0.8,78.8
43,LeGarrette Blount NE RB,0/0,0,0,0,194.8,835.5,6.1,4.5,33.4,0.2,122
44,Tevin Coleman Atl RB,0/0,0,0,0,123.8,519.4,3.9,23.4,170.6,0.6,92.4
45,Devontae Booker Den RB,0/0,0,0,0,106.1,439.7,3.5,19.1,151.7,0.5,80.7
46,Darren Sproles Phi RB,0/0,0,0,0,71.8,326.5,2.4,48.2,398.8,1.2,96.3
47,Jerick McKinnon Min RB,0/0,0,0,0,77.2,350.3,2.2,36.3,275.2,1,79.6
48,DeAndre Washington Oak RB,0/0,0,0,0,79.7,318.8,1.5,22.6,188.4,0.9,62.5
49,Shane Vereen NYG RB,0/0,0,0,0,60.9,264.7,1.5,50.8,451.6,2.8,96.8
50,Spencer Ware KC RB,0/0,0,0,0,80.6,353,4,5.6,41.2,0.1,63.1
51,Dion Lewis* NE RB O,0/0,0,0,0,61.1,245.7,1.9,33.6,295.8,1.2,69.9
52,Javorius Allen Bal RB,0/0,0,0,0,70.6,289.2,2.1,26.7,210.3,0.8,65.5
53,Terrance West Bal RB,0/0,0,0,0,105.9,431,2.9,8.8,65.7,0.2,65.2
54,C.J. Prosise Sea RB P,0/0,0,0,0,45.4,187.8,1.2,29.3,241,1.2,55.6
55,Chris Johnson Ari RB,0/0,0,0,0,100.4,425.9,2.7,2.1,15.4,0.1,58.5
56,James White NE RB,0/0,0,0,0,31,126.4,1,33.3,251.2,1.2,49.2
57,Christine Michael Sea RB,0/0,0,0,0,113.5,477.1,2.7,10.5,78.6,0.4,72.3
58,Jordan Howard Chi RB,0/0,0,0,0,101.1,407.6,3.6,7.9,59,0.2,66.3
59,Wendell Smallwood Phi RB P,0/0,0,0,0,41.2,166.5,1.3,9.8,72.4,0.3,31.6
60,Paul Perkins NYG RB,0/0,0,0,0,64.9,274,1.7,4.4,33.5,0.2,40.1
61,Kenneth Dixon Bal RB,0/0,0,0,0,47,200.8,1.2,13.2,98.6,0.4,37.9
62,Tim Hightower NO RB,0/0,0,0,0,82.1,320.8,3.1,10,73.2,0.3,58.4
63,Alfred Morris Dal RB,0/0,0,0,0,91.7,384.4,2.4,4.1,30.9,0.1,55.8
64,Charcandrick West KC RB P,0/0,0,0,0,42.2,168.9,2,9.3,68.6,0.2,35.1
65,Kenyan Drake Mia RB Q,0/0,0,0,0,42.7,168.4,0.9,26.6,230.2,1,49.6
66,Shaun Draughn SF RB P,0/0,0,0,0,83,316.8,1.8,42.4,312.5,1.1,78.1
67,Ka'Deem Carey Chi RB Q,0/0,0,0,0,91.9,385.7,2.5,11.8,88.4,0.3,61.7
68,Darren McFadden* Dal RB O,0/0,0,0,0,30.6,133.5,0.8,4.1,30.9,0.1,21.6
69,Josh Ferguson Ind RB,0/0,0,0,0,47.4,184.2,0.8,17.4,133.4,0.7,39.4
70,C.J. Spiller NO RB,0/0,0,0,0,31.3,134.2,0.8,37.1,273.3,1.1,52.2
71,Cameron Artis-Payne Car RB,0/0,0,0,0,66.3,272.7,1.9,7.5,55.6,0.3,43.7
72,Keith Marshall Wsh RB,0/0,0,0,0,71.7,300.8,1.8,4.4,32.8,0.1,44
73,Alex Collins Sea RB,0/0,0,0,0,22.7,87.1,0.8,0,0,0,12.3
74,Karlos Williams Buf RB SSPD,0/0,0,0,0,0,0,0,0,0,0,-1.3
75,Andre Ellington Ari RB,0/0,0,0,0,41.9,174.6,1,16.6,143.4,0.7,40.7
76,Tyler Ervin Hou RB,0/0,0,0,0,38.8,156.4,1.1,12.5,92.4,0.4,34.5
77,Chris Thompson Wsh RB,0/0,0,0,0,49.1,220.5,1.1,43.2,359.9,1.5,71.2
78,Branden Oliver SD RB,0/0,0,0,0,34.6,134.4,0.7,4.6,33.3,0.1,21.1
79,Khiry Robinson NYJ RB P,0/0,0,0,0,55.8,232.2,1.4,4.1,30.9,0.1,35
80,Ronnie Hillman Den RB,0/0,0,0,0,34,136.6,1,3.8,28,0.1,21.3
81,Benjamin Cunningham LA RB,0/0,0,0,0,38.3,157.7,1.2,24.3,198.5,0.5,43.9
82,Zach Zenner Det RB,0/0,0,0,0,56.5,241.6,1.7,4.6,35.4,0.1,37.6
83,Andre Williams NYG RB,0/0,0,0,0,69,256.2,2,2.2,16.8,0.1,38.6
84,Fozzy Whittaker Car RB,0/0,0,0,0,18.9,77.1,0.5,7.5,55.6,0.3,16.9
85,Mike Davis SF RB,0/0,0,0,0,19.8,76.3,0.5,4.2,30.9,0.1,13.3
86,Malcolm Brown LA RB,0/0,0,0,0,12.8,48.4,0.4,3.4,26.4,0.1,8.5
87,Reggie Bush Buf RB,0/0,0,0,0,78.2,330.2,2.1,12.8,95.7,0.5,57.9
88,Alfred Blue Hou RB P,0/0,0,0,0,64.7,249.3,1.6,4.2,30.8,0.1,36.9
89,Robert Turbin Ind RB,0/0,0,0,0,61.9,249.4,1.2,12.8,96.1,0.5,43.2
90,Mike Gillislee Buf RB Q,0/0,0,0,0,41.4,174.8,1.4,6.6,48.5,0.2,30
91,Lance Dunbar Dal RB,0/0,0,0,0,13.1,51.8,0.3,16.3,144.9,0.6,24.3
92,Stevan Ridley Det RB,0/0,0,0,0,17.7,73.6,0.5,4.6,35.4,0.1,13.6
93,Dexter McCluster Ten RB,0/0,0,0,0,18,76.3,0.4,16.8,151.7,0.8,32.1
94,Jonathan Williams Buf RB,0/0,0,0,0,9.2,34.8,0.3,0,0,0,4.7
95,Mike Tolbert Car RB,0/0,0,0,0,47.3,181.5,1.9,15.5,125.6,0.9,45.7
96,Fitzgerald Toussaint Pit RB,0/0,0,0,0,25.8,105.1,0.7,7.2,52.7,0.2,20.2
97,Donald Brown NE RB Q,0/0,0,0,0,5.8,23.2,0.2,4.4,33.5,0.2,6.8
98,Daniel Lasco NO RB,0/0,0,0,0,11.7,44.4,0.4,2.5,18.3,0.1,7.5
99,Dwayne Washington Det RB,0/0,0,0,0,1.8,7.1,0,0,0,0,0.3
100,Steven Jackson NE RB,--/--,--,--,--,--,--,--,--,--,--,--
101,John Kuhn NO RB,0/0,0,0,0,3.9,12.4,0.2,2.4,17.8,0.2,4.3
102,Fred Jackson Sea RB,--/--,--,--,--,--,--,--,--,--,--,--
103,Marshawn Lynch Sea RB,--/--,--,--,--,--,--,--,--,--,--,--
104,Ahmad Bradshaw Ind RB P,--/--,--,--,--,--,--,--,--,--,--,--
105,Pierre Thomas Wsh RB,--/--,--,--,--,--,--,--,--,--,--,--
106,Ray Rice FA RB,--/--,--,--,--,--,--,--,--,--,--,--
107,Jerome Felton Buf RB,0/0,0,0,0,0,0,0,1.6,11.8,0.1,1.6
108,Marcel Reece Oak RB SSPD,0/0,0,0,0,8.4,27.5,0.3,11.8,85.1,0.8,16.8
109,Jorvorskie Lane TB RB,--/--,--,--,--,--,--,--,--,--,--,--
110,Knowshon Moreno FA RB,--/--,--,--,--,--,--,--,--,--,--,--
111,Cedric Peerman Cin RB,0/0,0,0,0,4.4,17,0.1,0,0,0,1.7
112,Marcus Thigpen Buf RB,--/--,--,--,--,--,--,--,--,--,--,--
113,Darrel Young Chi RB,0/0,0,0,0,0,0,0,0,0,0,0
114,Antone Smith NYJ RB,0/0,0,0,0,0,0,0,0,0,0,0
115,Ben Tate Pit RB,--/--,--,--,--,--,--,--,--,--,--,--
116,Toby Gerhart Jax RB,--/--,--,--,--,--,--,--,--,--,--,--
117,Boobie Dixon Buf RB,--/--,--,--,--,--,--,--,--,--,--,--
118,Joique Bell Det RB,--/--,--,--,--,--,--,--,--,--,--,--
119,James Develin NE RB,0/0,0,0,0,7.8,25.1,0.4,4.4,32.5,0.3,9.2
120,Tyler Clutts Dal RB,--/--,--,--,--,--,--,--,--,--,--,--